<?xml version="1.0" encoding="UTF-8"?>
<Gimnasio xmlns:xsi="http://www.w3.org/2001/XMLSchema-instance"
 xsi:noNamespaceSchemaLocation="Gimnasio.xsd">
    <clase id="X123">
        <nombre>Pilates</nombre>
        <precio cuota="mensual" moneda="euro">27</precio>
        <plazas>20</plazas>
        <comienzo>01/03/2019</comienzo>
        <fin>29/06/2019</fin>
        <horario>M</horario>
        <profesor>Roberto Garcia</profesor>
        <sala>1</sala>
    </clase>
    <clase id="Z212">
        <nombre>Pilates</nombre>
        <precio cuota="trimestral" moneda="euro">27</precio>
        <plazas>20</plazas>
        <comienzo>01/03/2019</comienzo>
        <fin>29/06/2019</fin>
        <horario>T</horario>
        <profesor>Cynthia Carrillo</profesor>
        <sala>1</sala>
    </clase>
    <clase id="Z213">
        <nombre>Yoga</nombre>
        <precio cuota="mensual" moneda="euro">27</precio>
        <plazas>20</plazas>
        <comienzo>01/03/2019</comienzo>
        <fin>29/06/2019</fin>
        <horario>M</horario>
        <profesor>Roberto Garcia</profesor>
        <sala>1</sala>
    </clase>
    <clase id="Y122">
        <horario>T</horario>
        <profesor>Jose Limon</profesor>
        <sala>1</sala>
        <nombre>Yoga</nombre>
        <precio cuota="anual" moneda="euro">27</precio>
        <plazas>20</plazas>
        <comienzo>01/03/2019</comienzo>
    </clase>

    <clase id="Y131">
        <nombre>Bodybalance</nombre>
        <precio cuota="mensual" moneda="euro">27</precio>
        <plazas>20</plazas>
        <comienzo>01/03/2019</comienzo>
        <fin>29/06/2019</fin>
        <horario>M</horario>
        <profesor>Roberto Garcia</profesor>
        <sala>1</sala>
    </clase>
    <clase id="X132">
        <nombre>Bodybalance</nombre>
        <precio cuota="anual" moneda="euro">27</precio>
        <plazas>20</plazas>
        <comienzo>01/03/2019</comienzo>
        <horario>T</horario>
        <profesor>Jose Limon</profesor>
        <sala>1</sala>
    </clase>
    <clase id="Z141">
        <nombre>Bodycombat</nombre>
        <precio cuota="bimensual" moneda="euro">27</precio>
        <plazas>20</plazas>
        <comienzo>01/03/2019</comienzo>
        <fin>29/06/2019</fin>
        <horario>M</horario>
        <profesor>Daniel Lopez</profesor>
        <sala>2</sala>
    </clase>
    <clase id="Z142">
        <nombre>Bodycombat</nombre>
        <precio cuota="mensual" moneda="euro">27</precio>
        <plazas>20</plazas>
        <horario>T</horario>
        <profesor>Cynthia Carrillo</profesor>
        <sala>2</sala>
        <comienzo>01/03/2019</comienzo>
        <fin>29/06/2019</fin>
    </clase>
    <clase id="X151">
        <nombre>Bodypump</nombre>
        <precio cuota="mensual" moneda="euro">27</precio>
        <plazas>20</plazas>
        <comienzo>01/03/2019</comienzo>
        <fin>29/06/2019</fin>
        <horario>N</horario>
        <profesor>Ana Gallardo</profesor>
        <sala>2</sala>
    </clase>
    <clase id="X125">
        <nombre>Bodypump</nombre>
        <precio cuota="mensual" moneda="euro">27</precio>
        <plazas>20</plazas>
        <comienzo>01/03/2019</comienzo>
        <fin>29/06/2019</fin>
        <horario>N</horario>
        <profesor>Cynthia Carrillo</profesor>
        <sala>2</sala>
    </clase>
</Gimnasio>